### ISSUE TITLE
Echo is not finding any devices

### ISSUE THREAD

**Issue by miodzicho** [bwssytems/ha-bridge#1015]
I installed ha-bridge, tried to discover new devicas and always failing. Was tried also use link button before discovery.
ha-bridge installed on ubuntu together with Domoticz. I can see in ha-bridge yeelights from Domoticz just fine.
Echo gen 1 located on the same subnet as ha-bridge.
Log below 
`018-11-01 14:36:31,085 [main] INFO  com.bwssystems.HABridge.HABridge - HA Bridge startup sequence...
2018-11-01 14:36:31,246 [main] INFO  com.bwssystems.HABridge.BridgeSettings - reading from config file: /home/xxxxxxx/habridge/data/habridge.config
2018-11-01 14:36:32,922 [main] INFO  com.bwssystems.HABridge.HABridge - HA Bridge (v5.2.1) initializing....
2018-11-01 14:36:33,737 [main] INFO  spark.staticfiles.StaticFilesConfiguration - StaticResourceHandler configured with folder = /public
2018-11-01 14:36:34,328 [main] INFO  com.bwssystems.HABridge.SystemControl - System control service started....
2018-11-01 14:36:34,814 [main] INFO  com.bwssystems.HABridge.util.UDPDatagramSender - Initializing UDP response Socket...
2018-11-01 14:36:34,848 [main] WARN  com.bwssystems.HABridge.util.UDPDatagramSender - UDP Response Port is in use, starting loop to find open port for 20 tries - configured port is: 50000
2018-11-01 14:36:34,867 [main] INFO  com.bwssystems.HABridge.util.UDPDatagramSender - UDP response Socket initialized to: 50001
2018-11-01 14:36:34,891 [main] INFO  com.bwssystems.HABridge.plugins.http.HTTPHome - HTTP Home created.
2018-11-01 14:36:34,940 [main] INFO  com.bwssystems.HABridge.plugins.harmony.HarmonyHome - Harmony Home created. No Harmony devices configured.
2018-11-01 14:36:34,948 [main] INFO  com.bwssystems.HABridge.plugins.NestBridge.NestHome - Nest Home created. No Nest configured.
2018-11-01 14:36:34,949 [main] INFO  com.bwssystems.HABridge.plugins.hue.HueHome - Hue passthru Home created. No Hue passtrhu systems configured.
2018-11-01 14:36:34,950 [main] INFO  com.bwssystems.HABridge.plugins.hal.HalHome - HAL Home created. No HAL devices configured.
2018-11-01 14:36:34,956 [main] INFO  com.bwssystems.HABridge.plugins.mqtt.MQTTHome - MQTT Home created. No MQTT Clients configured.
2018-11-01 14:36:34,957 [main] INFO  com.bwssystems.HABridge.plugins.hass.HassHome - HomeAssistant Home created. No HomeAssistants configured.
2018-11-01 14:36:34,957 [main] INFO  com.bwssystems.HABridge.plugins.homewizard.HomeWizardHome - HomeWizard Home created. No HomeWizard gateways configured.
2018-11-01 14:36:34,958 [main] INFO  com.bwssystems.HABridge.plugins.exec.CommandHome - Command Home for system program execution created.
2018-11-01 14:36:34,961 [main] INFO  com.bwssystems.HABridge.plugins.tcp.TCPHome - TCP Home created.
2018-11-01 14:36:34,964 [main] INFO  com.bwssystems.HABridge.plugins.udp.UDPHome - UDP Home created.
2018-11-01 14:36:34,965 [main] INFO  com.bwssystems.HABridge.plugins.vera.VeraHome - Vera Home created. No Veras configured.
2018-11-01 14:36:34,970 [main] INFO  com.bwssystems.HABridge.plugins.fibaro.FibaroHome - Fibaro Home created. No Fibaros configured.
2018-11-01 14:36:34,971 [main] INFO  com.bwssystems.HABridge.plugins.domoticz.DomoticzHome - Domoticz Home created.
2018-11-01 14:36:34,973 [main] INFO  com.bwssystems.HABridge.plugins.somfy.SomfyHome - Somfy Home created. No Somfys configured.
2018-11-01 14:36:34,974 [main] INFO  com.bwssystems.HABridge.plugins.lifx.LifxHome - LifxDevice Home created. No LifxDevices configured.
2018-11-01 14:36:34,975 [main] INFO  com.bwssystems.HABridge.plugins.openhab.OpenHABHome - OpenHAB Home created. No OpenHABs configured.
2018-11-01 14:36:35,067 [main] INFO  com.bwssystems.HABridge.plugins.fhem.FHEMHome - FHEM Home created. No FHEMs configured.
2018-11-01 14:36:35,069 [main] INFO  com.bwssystems.HABridge.plugins.broadlink.BroadlinkHome - Broadlink Home created. No Broadlinks configured.
2018-11-01 14:36:35,135 [main] WARN  com.bwssystems.HABridge.dao.GroupRepository - Error reading the file: data/group.db - Does not exist or is not readable. continuing...
2018-11-01 14:36:35,135 [main] INFO  com.bwssystems.HABridge.devicemanagmeent.DeviceResource - HABridge device management service started.... 
2018-11-01 14:36:36,115 [main] INFO  com.bwssystems.HABridge.hue.HueMulator - Hue emulator service started....
2018-11-01 14:36:36,218 [Thread-0] INFO  spark.embeddedserver.jetty.EmbeddedJettyServer - == Spark has ignited ...
2018-11-01 14:36:36,219 [Thread-0] INFO  spark.embeddedserver.jetty.EmbeddedJettyServer - >> Listening on 0.0.0.0:80
2018-11-01 14:36:36,639 [Thread-0] ERROR com.bwssystems.HABridge.HABridge - Could not start ha-bridge webservice on port [80] due to: Address already in use
2018-11-01 14:45:48,376 [main] INFO  com.bwssystems.HABridge.HABridge - HA Bridge startup sequence...
2018-11-01 14:45:48,389 [main] INFO  com.bwssystems.HABridge.BridgeSettings - reading from config file: /home/gmiodek/habridge/data/habridge.config
2018-11-01 14:45:48,586 [main] INFO  com.bwssystems.HABridge.HABridge - HA Bridge (v5.2.0) initializing....
2018-11-01 14:45:48,698 [main] INFO  spark.staticfiles.StaticFilesConfiguration - StaticResourceHandler configured with folder = /public
2018-11-01 14:45:48,729 [main] INFO  com.bwssystems.HABridge.SystemControl - System control service started....
2018-11-01 14:45:48,803 [main] INFO  com.bwssystems.HABridge.util.UDPDatagramSender - Initializing UDP response Socket...
2018-11-01 14:45:48,804 [main] INFO  com.bwssystems.HABridge.util.UDPDatagramSender - UDP response Socket initialized to: 50000
2018-11-01 14:45:48,806 [main] INFO  com.bwssystems.HABridge.plugins.http.HTTPHome - HTTP Home created.
2018-11-01 14:45:48,811 [main] INFO  com.bwssystems.HABridge.plugins.harmony.HarmonyHome - Harmony Home created. No Harmony devices configured.
2018-11-01 14:45:48,811 [main] INFO  com.bwssystems.HABridge.plugins.NestBridge.NestHome - Nest Home created. No Nest configured.
2018-11-01 14:45:48,812 [main] INFO  com.bwssystems.HABridge.plugins.hue.HueHome - Hue passthru Home created. No Hue passtrhu systems configured.
2018-11-01 14:45:48,818 [main] INFO  com.bwssystems.HABridge.plugins.hal.HalHome - HAL Home created. No HAL devices configured.
2018-11-01 14:45:48,829 [main] INFO  com.bwssystems.HABridge.plugins.mqtt.MQTTHome - MQTT Home created. No MQTT Clients configured.
2018-11-01 14:45:48,830 [main] INFO  com.bwssystems.HABridge.plugins.hass.HassHome - HomeAssistant Home created. No HomeAssistants configured.
2018-11-01 14:45:48,830 [main] INFO  com.bwssystems.HABridge.plugins.homewizard.HomeWizardHome - HomeWizard Home created. No HomeWizard gateways configured.
2018-11-01 14:45:48,834 [main] INFO  com.bwssystems.HABridge.plugins.exec.CommandHome - Command Home for system program execution created.
2018-11-01 14:45:48,835 [main] INFO  com.bwssystems.HABridge.plugins.tcp.TCPHome - TCP Home created.
2018-11-01 14:45:48,836 [main] INFO  com.bwssystems.HABridge.plugins.udp.UDPHome - UDP Home created.
2018-11-01 14:45:48,836 [main] INFO  com.bwssystems.HABridge.plugins.vera.VeraHome - Vera Home created. No Veras configured.
2018-11-01 14:45:48,837 [main] INFO  com.bwssystems.HABridge.plugins.fibaro.FibaroHome - Fibaro Home created. No Fibaros configured.
2018-11-01 14:45:48,837 [main] INFO  com.bwssystems.HABridge.plugins.domoticz.DomoticzHome - Domoticz Home created.
2018-11-01 14:45:48,849 [main] INFO  com.bwssystems.HABridge.plugins.somfy.SomfyHome - Somfy Home created. No Somfys configured.
2018-11-01 14:45:48,850 [main] INFO  com.bwssystems.HABridge.plugins.lifx.LifxHome - LifxDevice Home created. No LifxDevices configured.
2018-11-01 14:45:48,851 [main] INFO  com.bwssystems.HABridge.plugins.openhab.OpenHABHome - OpenHAB Home created. No OpenHABs configured.
2018-11-01 14:45:48,857 [main] INFO  com.bwssystems.HABridge.plugins.fhem.FHEMHome - FHEM Home created. No FHEMs configured.
2018-11-01 14:45:48,858 [main] INFO  com.bwssystems.HABridge.plugins.broadlink.BroadlinkHome - Broadlink Home created. No Broadlinks configured.
2018-11-01 14:45:48,881 [Thread-0] INFO  spark.embeddedserver.jetty.EmbeddedJettyServer - == Spark has ignited ...
2018-11-01 14:45:48,882 [Thread-0] INFO  spark.embeddedserver.jetty.EmbeddedJettyServer - >> Listening on 0.0.0.0:80
2018-11-01 14:45:48,886 [main] WARN  com.bwssystems.HABridge.dao.GroupRepository - Error reading the file: data/group.db - Does not exist or is not readable. continuing...
2018-11-01 14:45:48,886 [main] INFO  com.bwssystems.HABridge.devicemanagmeent.DeviceResource - HABridge device management service started.... 
2018-11-01 14:45:48,941 [main] INFO  com.bwssystems.HABridge.hue.HueMulator - Hue emulator service started....
2018-11-01 14:45:49,009 [main] INFO  com.bwssystems.HABridge.HABridge - Traceupnp: upnp config address: 10.36.90.18-useIface:true on web server: 0.0.0.0:80
2018-11-01 14:45:49,010 [main] INFO  com.bwssystems.HABridge.upnp.UpnpSettingsResource - Description xml service started....
2018-11-01 14:45:49,015 [main] INFO  com.bwssystems.HABridge.upnp.UpnpListener - UPNP Discovery Listener starting....
2018-11-01 14:45:49,015 [main] INFO  com.bwssystems.HABridge.upnp.UpnpListener - Traceupnp: Interface: ens160 matches upnp config address of IP address: /10.36.90.18
2018-11-01 14:45:49,016 [main] INFO  com.bwssystems.HABridge.upnp.UpnpListener - Traceupnp: Adding ens160 to our upnp join interface set.
2018-11-01 14:45:49,017 [main] INFO  com.bwssystems.HABridge.upnp.UpnpListener - UPNP Discovery Listener running and ready....
2018-11-01 14:45:52,424 [qtp977301491-12] INFO  com.bwssystems.HABridge.hue.HueMulator - Traceupnp: hue api user create requested for device type: test_ha_bridge#10.36.91.116 and username: 7b4edb35de6447e6a6481f68d065b3b5
2018-11-01 14:46:00,470 [qtp977301491-9] INFO  com.bwssystems.HABridge.SystemControl - Link button pressed....
2018-11-01 14:46:30,470 [Timer-1] INFO  com.bwssystems.HABridge.LinkButtonPressed - Link button time ended....
2018-11-01 14:46:36,812 [qtp977301491-11] INFO  com.bwssystems.HABridge.SystemControl - Link button pressed....
2018-11-01 14:47:06,814 [Timer-2] INFO  com.bwssystems.HABridge.LinkButtonPressed - Link button time ended....
2018-11-01 14:47:57,564 [main] INFO  com.bwssystems.HABridge.upnp.UpnpListener - Traceupnp: SSDP M-SEARCH packet from 10.36.90.254:57457
2018-11-01 14:47:58,215 [main] INFO  com.bwssystems.HABridge.upnp.UpnpListener - Traceupnp: send upnp discovery template 1 with response address: 10.36.90.18:80 to address: /10.36.90.254:57457
2018-11-01 14:47:58,866 [main] INFO  com.bwssystems.HABridge.upnp.UpnpListener - Traceupnp: send upnp discovery template 2 with response address: 10.36.90.18:80 to address: /10.36.90.254:57457
2018-11-01 14:47:59,517 [main] INFO  com.bwssystems.HABridge.upnp.UpnpListener - Traceupnp: send upnp discovery template 3 with response address: 10.36.90.18:80 to address: /10.36.90.254:57457
2018-11-01 14:48:01,523 [qtp977301491-14] INFO  com.bwssystems.HABridge.upnp.UpnpSettingsResource - Traceupnp: request of description.xml from: 10.36.90.254:80 filled in with address: 10.36.90.18:80
2018-11-01 14:48:01,586 [qtp977301491-15] INFO  com.bwssystems.HABridge.upnp.UpnpSettingsResource - Traceupnp: request of description.xml from: 10.36.90.254:80 filled in with address: 10.36.90.18:80
2018-11-01 14:48:01,618 [qtp977301491-9] INFO  com.bwssystems.HABridge.upnp.UpnpSettingsResource - Traceupnp: request of description.xml from: 10.36.90.254:80 filled in with address: 10.36.90.18:80
2018-11-01 14:48:02,091 [qtp977301491-9] INFO  com.bwssystems.HABridge.upnp.UpnpSettingsResource - Traceupnp: request of description.xml from: 10.36.90.254:80 filled in with address: 10.36.90.18:80
2018-11-01 14:48:02,195 [qtp977301491-13] INFO  com.bwssystems.HABridge.upnp.UpnpSettingsResource - Traceupnp: request of description.xml from: 10.36.90.254:80 filled in with address: 10.36.90.18:80
2018-11-01 14:48:02,223 [qtp977301491-14] INFO  com.bwssystems.HABridge.upnp.UpnpSettingsResource - Traceupnp: request of description.xml from: 10.36.90.254:80 filled in with address: 10.36.90.18:80
2018-11-01 14:48:02,239 [qtp977301491-16] INFO  com.bwssystems.HABridge.upnp.UpnpSettingsResource - Traceupnp: request of description.xml from: 10.36.90.254:80 filled in with address: 10.36.90.18:80
`

bridge on 10.36.90.18, I see only request coming from QNAP on .254

**Comment by bwssytems** [comment]
You have something running on port 80 already as  the error in your log identifies. Please make sure you have read your log and understand the errors before posting.


2018-11-01 14:36:36,639 [Thread-0] ERROR com.bwssystems.HABridge.HABridge - Could not start ha-bridge webservice on port [80] due to: Address already in use

**Comment by Bratensosse** [comment]
@audiofreak9 do you mean, that there is no way that  habridge and alexa work together?
What is the reason?

**Comment by audiofreak9** [comment]
Not saying that at all, just letting you know currently others are having issue with Gen 3 and HA-Bridge discovery.  @bwssytems is aware of the reported issue.

**Comment by aiio** [comment]
Is there any way to keep ha-bridge running on another port than 80 (there is my apache) and let echo dot gen. 3 find the devices? Something like a rewrite-rule inside apache?

Today i switched from echo dot gen. 2 to gen. 3 and now i have the same issue.

**Comment by Bratensosse** [comment]
Thanks dir your answer :-) As i explained in my post. The ip adress of my Echo dot 3rd gen is 192.168.2.42.

**Comment by bwssytems** [comment]
@Bratensosse Sorry about that, read to quickly. Interesting that the ha-bridge is replying but the echo is not asking for the next step which is to get the description.xml. Try changing the "UPNP Send Delay" in bridge control to 250.

**Comment by Bratensosse** [comment]
@bwssytems Thank you for helping me. Unfortunately that is not the solution. The log file looks like before changing the upnp send delay. Do you have other solution proposal, that can i try?

**Comment by bwssytems** [comment]
The only thing I can say is to look into your network setup as others have gotten the gen 3 to work. If you are willing to dig down, doing a network sniff with wireshark or tcpdump would be the next thing and would help me.

**Comment by Bratensosse** [comment]
That sounds quite complicate. I have to understand how tcpdump works and how i create the data you need first. But i will try it. Do you have the comand for tcpdump?

**Comment by craigski** [comment]
> The only thing I can say is to look into your network setup as others have gotten the gen 3 to work.

Could the way the WiFi is configured be affecting the discovery process that is affecting some users and some devices? Im thinking if the WiFi is configured for both 2.4 & 5Ghz with same or separate SSID, devices may be connecting to different bands, and could (but shouldn't) affect the UPnP discovery process, depending on how the WiFi network is configured?

**Comment by Bratensosse** [comment]
Hi,

@craigski: thanks for your comment. I disabled the 5Ghz Wifi for testing. But still the same problem

@bwssytems: i installed tcpdump on my bananapi (192.168.2.2 with habridge) and made a run while alexa is looking for new devices and the link button is pressed. I used this call promt:  sudo tcpdump -i eth0 host 192.168.2.42

192.168.2.42 is the echo dot. Here you can see the result:

tcpdump: verbose output suppressed, use -v or -vv for full protocol decode
listening on eth0, link-type EN10MB (Ethernet), capture size 262144 bytes
21:28:35.698563 IP amazon-xxxxxxxxxx.local.50000 > 239.255.255.250.1900: UDP, length 94
21:28:35.698695 IP amazon-xxxxxxxxxx.local.50000 > 239.255.255.250.1900: UDP, length 101
21:28:35.698720 IP amazon-xxxxxxxxxx.local.50000 > 239.255.255.250.1900: UDP, length 94
21:28:35.698739 IP amazon-xxxxxxxxxx.local.50000 > 239.255.255.250.1900: UDP, length 101
21:28:35.708189 IP amazon-xxxxxxxxxx.local.50000 > 239.255.255.250.1900: UDP, length 94
21:28:35.708668 IP amazon-xxxxxxxxxx.local.50000 > 239.255.255.250.1900: UDP, length 101
21:28:35.880924 ARP, Request who-has amazon-xxxxxxxxxx.local tell fritz.repeater.local, length 46
21:28:35.882710 ARP, Request who-has amazon-xxxxxxxxxx.local tell octopi.local, length 46
21:28:35.951312 ARP, Request who-has amazon-xxxxxxxxxx.local tell bananapi, length 28
21:28:36.013126 ARP, Request who-has amazon-xxxxxxxxxx.local tell Notebook.local, length 46
21:28:36.875149 ARP, Request who-has amazon-xxxxxxxxxx.local tell fritz.repeater.local, length 46
21:28:36.915623 ARP, Request who-has amazon-xxxxxxxxxx.local tell octopi.local, length 46
21:28:36.944498 ARP, Request who-has amazon-xxxxxxxxxx.local tell bananapi, length 28
21:28:37.002115 ARP, Request who-has amazon-xxxxxxxxxx.local tell Notebook.local, length 46
21:28:37.875757 ARP, Request who-has amazon-xxxxxxxxxx.local tell fritz.repeater.local, length 46
21:28:37.944494 ARP, Request who-has amazon-xxxxxxxxxx.local tell bananapi, length 28
21:28:37.955641 ARP, Request who-has amazon-xxxxxxxxxx.local tell octopi.local, length 46
21:28:37.963611 ARP, Request who-has amazon-xxxxxxxxxx.local tell Notebook.local, length 46
21:28:38.964198 ARP, Request who-has amazon-xxxxxxxxxx.local tell Notebook.local, length 46
21:28:38.970833 ARP, Request who-has amazon-xxxxxxxxxx.local tell bananapi, length 28
21:28:39.964498 ARP, Request who-has amazon-xxxxxxxxxx.local tell bananapi, length 28
21:28:40.964489 ARP, Request who-has amazon-xxxxxxxxxx.local tell bananapi, length 28
21:28:51.316898 ARP, Request who-has amazon-xxxxxxxxxx.local tell easy.box.local, length 46
^C
23 packets captured
23 packets received by filter
0 packets dropped by kernel


xxxxxx means, that i have blacked out the name of my echo dot

Do you see any  reason why it still not work?

**Comment by craigski** [comment]
@Bratensosse are you 100% sure the IP address of echo is .42? What is IP of your laptop/PC?

Im also seeing the SSDP M-SEARCH in log every second or so, but that's coming from a windows 10 PC on my network, maybe you are doing a trace on wrong IP?

**Comment by craigski** [comment]
@bwssytems can you help me understand the UPnP log. When I initiate a discovery I see the following lines in log:

1) Traceupnp: hue lights list requested by user: xxxxxxx from address: 192.168.1.34

2) Traceupnp: hue api user create requested for device type: test_ha_bridge#192.168.1.56 and username: uuuuuuuuuuu

3) Traceupnp: request of description.xml from: 192.168.1.56:8081 filled in with address: 192.168.1.124:8081

During normal operation I see the following every 1 second or so from my Windows 10 PC:

4) Traceupnp: SSDP M-SEARCH packet from 192.168.1.56:50413

.34 is my Gen2 Echo Dot that I initiated search from
.124 is my Pi/HABridge
.56 is a windows 10 PC

It seems the service 'SSDP Discovery' service on windows is creating these 'SSDP M-SEARCH' requests, I proved this by disabling the service on Windows PC, now my HABridge log is a lot cleaner.

I'm wondering if there are multiple devices on a network, they are all generating these SSDP M-SEARCH requests, maybe the network is flooded with them, and is interfering in the Echo discovery process that takes 20 seconds or so?

**Comment by craigski** [comment]
@Bratensosse see my post here:

[https://github.com/bwssytems/ha-bridge/issues/1022#issuecomment-447318634](url)

Re tcpdump, here is what I used to resolve my issue:

I was using SSH to connect to Pi/HABridge, I excluded this in the following <ip address of PC> below

`sudo tcpdump -v host <ip address of Pi> and not host <ip address of PC> -w tcpdump80link2new.cap
`
Run your discovery, then review the tcpdump:

`tcpdump -qns 0 -A -r tcpdump80link2new.cap`

**Comment by bwssytems** [comment]
@craigski Since upnp is a broadcast system in itself, there maybe other applications looking for a service. That is why you will see those requests in the HA-bridge log as we need to interrogate the search request to see if it is for the "Hue" service.

The other messages are the handshake after discovery of the ha-bridge service and are pertinent as it means the requester (the echo) has found the bridge and is requesting the lights info.

**Comment by Bratensosse** [comment]
Thx for your help. I am quite sure, that i use the correct IP of my echo :-)

@craigski i used your promt while i start the discovery twice. Before i did that, i stopped other services like fhem and samba server on my bananapi to reduce the data:

sudo tcpdump -v host 192.168.2.2 and not host 192.168.2.19 -w output.dat
sudo tcpdump -qns 0 -A -r output.dat

For explanation:
x.x.x.42: Echo dot
x.x.x.19: My PC (conected to Bananapi via ssh)
x.x.x.2: Bananapi with habridge
x.x.x.1: local router 

I really hope, that you can analyse the reason why it still not work... thanks a lot!
Here is the result:-):

E..L.G@.@.1....._.Q..{.{.8tX#.....................st.....?.......j........Nt
21:15:02.897946 IP xx.xx.xx.xx.xxx > 192.168.2.2.123: UDP, length 48
E..L..@.9..._.Q......{.{.8".$..........9.5gl....        ./U......Nt......&u......1.
21:15:03.495523 ARP, Request who-has 192.168.2.2 tell 192.168.2.1, length 46
...........{;x................................
21:15:03.495586 ARP, Reply 192.168.2.2 is-at 02:d2:0b:01:76:67, length 28
............vg.......{;x....
21:15:16.125895 ARP, Request who-has 192.168.2.42 tell 192.168.2.2, length 28
............vg.............*
21:15:16.633848 IP 192.168.2.2.1900 > 239.255.255.250.1900: UDP, length 317
E..Y.$@...3..........l.l.E..NOTIFY * HTTP/1.1
HOST: 239.255.255.250:1900
CACHE-CONTROL: max-age=100
LOCATION: http://192.168.2.2:80/description.xml
SERVER: Linux/3.14.0 UPnP/1.0 IpBridge/1.19.0
NTS: ssdp:alive
hue-bridgeid: 02D20BFFFE017667
NT: uuid:2f402f80-da50-11e1-9b23-02d20b017667
USN: uuid:2f402f80-da50-11e1-9b23-02d20b017667


21:15:17.122281 ARP, Request who-has 192.168.2.42 tell 192.168.2.2, length 28
............vg.............*
21:15:18.122245 ARP, Request who-has 192.168.2.42 tell 192.168.2.2, length 28
............vg.............*
21:15:19.166015 ARP, Request who-has 192.168.2.42 tell 192.168.2.2, length 28
............vg.............*
21:15:20.162233 ARP, Request who-has 192.168.2.42 tell 192.168.2.2, length 28
............vg.............*
21:15:21.162225 ARP, Request who-has 192.168.2.42 tell 192.168.2.2, length 28
............vg.............*
21:15:33.491787 ARP, Request who-has 192.168.2.2 tell 192.168.2.1, length 46
...........{;x................................
21:15:33.491852 ARP, Reply 192.168.2.2 is-at 02:d2:0b:01:76:67, length 28
............vg.......{;x....
21:15:36.752347 IP 192.168.2.2.1900 > 239.255.255.250.1900: UDP, length 317
E..Y..@...-..........l.l.E..NOTIFY * HTTP/1.1
HOST: 239.255.255.250:1900
CACHE-CONTROL: max-age=100
LOCATION: http://192.168.2.2:80/description.xml
SERVER: Linux/3.14.0 UPnP/1.0 IpBridge/1.19.0
NTS: ssdp:alive
hue-bridgeid: 02D20BFFFE017667
NT: uuid:2f402f80-da50-11e1-9b23-02d20b017667
USN: uuid:2f402f80-da50-11e1-9b23-02d20b017667

**Comment by craigski** [comment]
@Bratensosse I can't see a correlation with the tcpdumps you have posted and the log file on 4/12/2018. The UPnP log shows some network traffic on port 80 of the bananapi/ha-bridge, the tcpdumps dont.

Start tcpdump again, initiate a discover from the Echo, ie 'Alexa, discover devices' then when discovery has finished, stop tcpdump, should be 20 secs or so.

I dont think the discovery is starting in your tcpdumps above.

**Comment by Bratensosse** [comment]
@craigski i did dtart dcpdump again while discover alexa two times and the link button was pressed. again i stopped other services on the banana pi.

i will post the log of the habridge and the result of the dcpdump:


12-15-2018 09:23:03.229 | INFO | HA Bridge startup sequence... | com.bwssystems.HABridge.HABridge
-- | -- | -- | --
12-15-2018 09:23:03.312 | INFO | reading from config file: /home/pi/habridge/data/habridge.config | com.bwssystems.HABridge.BridgeSettings
12-15-2018 09:23:06.339 | INFO | HA Bridge (v5.2.1) initializing.... | com.bwssystems.HABridge.HABridge
12-15-2018 09:23:06.439 | INFO | StaticResourceHandler configured with folder = /public | spark.staticfiles.StaticFilesConfiguration
12-15-2018 09:23:06.517 | INFO | System control service started.... | com.bwssystems.HABridge.SystemControl
12-15-2018 09:23:06.840 | INFO | Initializing UDP response Socket... | com.bwssystems.HABridge.util.UDPDatagramSender
12-15-2018 09:23:06.862 | INFO | UDP response Socket initialized to: 50000 | com.bwssystems.HABridge.util.UDPDatagramSender
12-15-2018 09:23:06.884 | INFO | HTTP Home created. | com.bwssystems.HABridge.plugins.http.HTTPHome
12-15-2018 09:23:06.917 | INFO | Harmony Home created. No Harmony devices configured. | com.bwssystems.HABridge.plugins.harmony.HarmonyHome
12-15-2018 09:23:06.941 | INFO | Nest Home created. No Nest configured. | com.bwssystems.HABridge.plugins.NestBridge.NestHome
12-15-2018 09:23:06.947 | INFO | Hue passthru Home created. No Hue passtrhu systems configured. | com.bwssystems.HABridge.plugins.hue.HueHome
12-15-2018 09:23:06.955 | INFO | HAL Home created. No HAL devices configured. | com.bwssystems.HABridge.plugins.hal.HalHome
12-15-2018 09:23:06.961 | INFO | MQTT Home created. No MQTT Clients configured. | com.bwssystems.HABridge.plugins.mqtt.MQTTHome
12-15-2018 09:23:06.968 | INFO | HomeAssistant Home created. No HomeAssistants configured. | com.bwssystems.HABridge.plugins.hass.HassHome
12-15-2018 09:23:06.974 | INFO | HomeWizard Home created. No HomeWizard gateways configured. | com.bwssystems.HABridge.plugins.homewizard.HomeWizardHome
12-15-2018 09:23:06.991 | INFO | Command Home for system program execution created. | com.bwssystems.HABridge.plugins.exec.CommandHome
12-15-2018 09:23:06.999 | INFO | TCP Home created. | com.bwssystems.HABridge.plugins.tcp.TCPHome
12-15-2018 09:23:07.011 | INFO | UDP Home created. | com.bwssystems.HABridge.plugins.udp.UDPHome
12-15-2018 09:23:07.017 | INFO | Vera Home created. No Veras configured. | com.bwssystems.HABridge.plugins.vera.VeraHome
12-15-2018 09:23:07.023 | INFO | Fibaro Home created. No Fibaros configured. | com.bwssystems.HABridge.plugins.fibaro.FibaroHome
12-15-2018 09:23:07.031 | INFO | Domoticz Home created. No Domoticz devices configured. | com.bwssystems.HABridge.plugins.domoticz.DomoticzHome
12-15-2018 09:23:07.037 | INFO | Somfy Home created. No Somfys configured. | com.bwssystems.HABridge.plugins.somfy.SomfyHome
12-15-2018 09:23:07.050 | INFO | LifxDevice Home created. No LifxDevices configured. | com.bwssystems.HABridge.plugins.lifx.LifxHome
12-15-2018 09:23:07.059 | INFO | OpenHAB Home created. No OpenHABs configured. | com.bwssystems.HABridge.plugins.openhab.OpenHABHome
12-15-2018 09:23:07.067 | INFO | FHEM Home created. No FHEMs configured. | com.bwssystems.HABridge.plugins.fhem.FHEMHome
12-15-2018 09:23:07.091 | INFO | Broadlink Home created. No Broadlinks configured. | com.bwssystems.HABridge.plugins.broadlink.BroadlinkHome
12-15-2018 09:23:07.202 | WARN | Error reading the file: data/group.db - Does not exist or is not readable. continuing... | com.bwssystems.HABridge.dao.GroupRepository
12-15-2018 09:23:07.203 | INFO | HABridge device management service started.... | com.bwssystems.HABridge.devicemanagmeent.DeviceResource
12-15-2018 09:23:07.241 | INFO | == Spark has ignited ... | spark.embeddedserver.jetty.EmbeddedJettyServer
12-15-2018 09:23:07.253 | INFO | >> Listening on 0.0.0.0:80 | spark.embeddedserver.jetty.EmbeddedJettyServer
12-15-2018 09:23:07.423 | INFO | Hue emulator service started.... | com.bwssystems.HABridge.hue.HueMulator
12-15-2018 09:23:07.688 | INFO | Traceupnp: upnp config address: 192.168.2.2-useIface:false on web server: 0.0.0.0:80 | com.bwssystems.HABridge.HABridge
12-15-2018 09:23:07.693 | INFO | Description xml service started.... | com.bwssystems.HABridge.upnp.UpnpSettingsResource
12-15-2018 09:23:07.731 | INFO | UPNP Discovery Listener starting.... | com.bwssystems.HABridge.upnp.UpnpListener
12-15-2018 09:23:07.733 | INFO | Traceupnp: Interface: eth0 valid usable IP address: /192.168.2.2 | com.bwssystems.HABridge.upnp.UpnpListener
12-15-2018 09:23:07.736 | INFO | Traceupnp: Adding eth0 to our upnp join interface set. | com.bwssystems.HABridge.upnp.UpnpListener
12-15-2018 09:23:07.737 | INFO | Traceupnp: Interface: lo valid usable IP address: /127.0.0.1 | com.bwssystems.HABridge.upnp.UpnpListener
12-15-2018 09:23:07.738 | INFO | Traceupnp: Adding lo to our upnp join interface set. | com.bwssystems.HABridge.upnp.UpnpListener
12-15-2018 09:23:07.739 | INFO | UPNP Discovery Listener running and ready.... | com.bwssystems.HABridge.upnp.UpnpListener
12-15-2018 09:23:43.502 | INFO | Traceupnp: hue api user create requested for  device type: test_ha_bridge#192.168.2.19 and username:  xxxxxxxxxxxxxxxxxxxxxxxxxxxxxx | com.bwssystems.HABridge.hue.HueMulator
12-15-2018 09:24:21.448 | INFO | Traceupnp: SSDP M-SEARCH packet from 192.168.2.42:50000 | com.bwssystems.HABridge.upnp.UpnpListener
12-15-2018 09:24:21.701 | INFO | Traceupnp: send upnp discovery template 1 with response address: 192.168.2.2:80 to address: /192.168.2.42:50000 | com.bwssystems.HABridge.upnp.UpnpListener
12-15-2018 09:24:21.955 | INFO | Traceupnp: send upnp discovery template 2 with response address: 192.168.2.2:80 to address: /192.168.2.42:50000 | com.bwssystems.HABridge.upnp.UpnpListener
12-15-2018 09:24:22.135 | INFO | Link button pressed.... | com.bwssystems.HABridge.SystemControl
12-15-2018 09:24:22.209 | INFO | Traceupnp: send upnp discovery template 3 with response address: 192.168.2.2:80 to address: /192.168.2.42:50000 | com.bwssystems.HABridge.upnp.UpnpListener
12-15-2018 09:24:22.214 | INFO | Traceupnp: SSDP M-SEARCH packet from 192.168.2.42:50000 | com.bwssystems.HABridge.upnp.UpnpListener
12-15-2018 09:24:22.467 | INFO | Traceupnp: send upnp discovery template 1 with response address: 192.168.2.2:80 to address: /192.168.2.42:50000 | com.bwssystems.HABridge.upnp.UpnpListener
12-15-2018 09:24:22.721 | INFO | Traceupnp: send upnp discovery template 2 with response address: 192.168.2.2:80 to address: /192.168.2.42:50000 | com.bwssystems.HABridge.upnp.UpnpListener
12-15-2018 09:24:22.974 | INFO | Traceupnp: send upnp discovery template 3 with response address: 192.168.2.2:80 to address: /192.168.2.42:50000 | com.bwssystems.HABridge.upnp.UpnpListener
12-15-2018 09:24:22.976 | INFO | Traceupnp: SSDP M-SEARCH packet from 192.168.2.42:50000 | com.bwssystems.HABridge.upnp.UpnpListener
12-15-2018 09:24:23.229 | INFO | Traceupnp: send upnp discovery template 1 with response address: 192.168.2.2:80 to address: /192.168.2.42:50000 | com.bwssystems.HABridge.upnp.UpnpListener
12-15-2018 09:24:23.482 | INFO | Traceupnp: send upnp discovery template 2 with response address: 192.168.2.2:80 to address: /192.168.2.42:50000 | com.bwssystems.HABridge.upnp.UpnpListener
12-15-2018 09:24:23.735 | INFO | Traceupnp: send upnp discovery template 3 with response address: 192.168.2.2:80 to address: /192.168.2.42:50000 | com.bwssystems.HABridge.upnp.UpnpListener
12-15-2018 09:24:23.737 | INFO | Traceupnp: SSDP M-SEARCH packet from 192.168.2.42:50000 | com.bwssystems.HABridge.upnp.UpnpListener
12-15-2018 09:24:23.990 | INFO | Traceupnp: send upnp discovery template 1 with response address: 192.168.2.2:80 to address: /192.168.2.42:50000 | com.bwssystems.HABridge.upnp.UpnpListener
12-15-2018 09:24:24.243 | INFO | Traceupnp: send upnp discovery template 2 with response address: 192.168.2.2:80 to address: /192.168.2.42:50000 | com.bwssystems.HABridge.upnp.UpnpListener
12-15-2018 09:24:24.496 | INFO | Traceupnp: send upnp discovery template 3 with response address: 192.168.2.2:80 to address: /192.168.2.42:50000 | com.bwssystems.HABridge.upnp.UpnpListener
12-15-2018 09:24:24.498 | INFO | Traceupnp: SSDP M-SEARCH packet from 192.168.2.42:50000 | com.bwssystems.HABridge.upnp.UpnpListener
12-15-2018 09:24:24.750 | INFO | Traceupnp: send upnp discovery template 1 with response address: 192.168.2.2:80 to address: /192.168.2.42:50000 | com.bwssystems.HABridge.upnp.UpnpListener
12-15-2018 09:24:25.004 | INFO | Traceupnp: send upnp discovery template 2 with response address: 192.168.2.2:80 to address: /192.168.2.42:50000 | com.bwssystems.HABridge.upnp.UpnpListener
12-15-2018 09:24:25.257 | INFO | Traceupnp: send upnp discovery template 3 with response address: 192.168.2.2:80 to address: /192.168.2.42:50000 | com.bwssystems.HABridge.upnp.UpnpListener
12-15-2018 09:24:25.258 | INFO | Traceupnp: SSDP M-SEARCH packet from 192.168.2.42:50000 | com.bwssystems.HABridge.upnp.UpnpListener
12-15-2018 09:24:25.511 | INFO | Traceupnp: send upnp discovery template 1 with response address: 192.168.2.2:80 to address: /192.168.2.42:50000 | com.bwssystems.HABridge.upnp.UpnpListener
12-15-2018 09:24:25.764 | INFO | Traceupnp: send upnp discovery template 2 with response address: 192.168.2.2:80 to address: /192.168.2.42:50000 | com.bwssystems.HABridge.upnp.UpnpListener
12-15-2018 09:24:26.017 | INFO | Traceupnp: send upnp discovery template 3 with response address: 192.168.2.2:80 to address: /192.168.2.42:50000 | com.bwssystems.HABridge.upnp.UpnpListener
12-15-2018 09:24:43.097 | INFO | Traceupnp: SSDP M-SEARCH packet from 192.168.2.42:50000 | com.bwssystems.HABridge.upnp.UpnpListener
12-15-2018 09:24:43.350 | INFO | Traceupnp: send upnp discovery template 1 with response address: 192.168.2.2:80 to address: /192.168.2.42:50000 | com.bwssystems.HABridge.upnp.UpnpListener
12-15-2018 09:24:43.603 | INFO | Traceupnp: send upnp discovery template 2 with response address: 192.168.2.2:80 to address: /192.168.2.42:50000 | com.bwssystems.HABridge.upnp.UpnpListener
12-15-2018 09:24:43.857 | INFO | Traceupnp: send upnp discovery template 3 with response address: 192.168.2.2:80 to address: /192.168.2.42:50000 | com.bwssystems.HABridge.upnp.UpnpListener
12-15-2018 09:24:43.861 | INFO | Traceupnp: SSDP M-SEARCH packet from 192.168.2.42:50000 | com.bwssystems.HABridge.upnp.UpnpListener
12-15-2018 09:24:44.113 | INFO | Traceupnp: send upnp discovery template 1 with response address: 192.168.2.2:80 to address: /192.168.2.42:50000 | com.bwssystems.HABridge.upnp.UpnpListener
12-15-2018 09:24:44.366 | INFO | Traceupnp: send upnp discovery template 2 with response address: 192.168.2.2:80 to address: /192.168.2.42:50000 | com.bwssystems.HABridge.upnp.UpnpListener
12-15-2018 09:24:44.396 | INFO | Link button pressed.... | com.bwssystems.HABridge.SystemControl
12-15-2018 09:24:44.619 | INFO | Traceupnp: send upnp discovery template 3 with response address: 192.168.2.2:80 to address: /192.168.2.42:50000 | com.bwssystems.HABridge.upnp.UpnpListener
12-15-2018 09:24:44.621 | INFO | Traceupnp: SSDP M-SEARCH packet from 192.168.2.42:50000 | com.bwssystems.HABridge.upnp.UpnpListener
12-15-2018 09:24:44.874 | INFO | Traceupnp: send upnp discovery template 1 with response address: 192.168.2.2:80 to address: /192.168.2.42:50000 | com.bwssystems.HABridge.upnp.UpnpListener
12-15-2018 09:24:45.128 | INFO | Traceupnp: send upnp discovery template 2 with response address: 192.168.2.2:80 to address: /192.168.2.42:50000 | com.bwssystems.HABridge.upnp.UpnpListener
12-15-2018 09:24:45.381 | INFO | Traceupnp: send upnp discovery template 3 with response address: 192.168.2.2:80 to address: /192.168.2.42:50000 | com.bwssystems.HABridge.upnp.UpnpListener
12-15-2018 09:24:45.382 | INFO | Traceupnp: SSDP M-SEARCH packet from 192.168.2.42:50000 | com.bwssystems.HABridge.upnp.UpnpListener
12-15-2018 09:24:45.635 | INFO | Traceupnp: send upnp discovery template 1 with response address: 192.168.2.2:80 to address: /192.168.2.42:50000 | com.bwssystems.HABridge.upnp.UpnpListener
12-15-2018 09:24:45.888 | INFO | Traceupnp: send upnp discovery template 2 with response address: 192.168.2.2:80 to address: /192.168.2.42:50000 | com.bwssystems.HABridge.upnp.UpnpListener
12-15-2018 09:24:46.141 | INFO | Traceupnp: send upnp discovery template 3 with response address: 192.168.2.2:80 to address: /192.168.2.42:50000 | com.bwssystems.HABridge.upnp.UpnpListener
12-15-2018 09:24:46.143 | INFO | Traceupnp: SSDP M-SEARCH packet from 192.168.2.42:50000 | com.bwssystems.HABridge.upnp.UpnpListener
12-15-2018 09:24:46.396 | INFO | Traceupnp: send upnp discovery template 1 with response address: 192.168.2.2:80 to address: /192.168.2.42:50000 | com.bwssystems.HABridge.upnp.UpnpListener
12-15-2018 09:24:46.650 | INFO | Traceupnp: send upnp discovery template 2 with response address: 192.168.2.2:80 to address: /192.168.2.42:50000 | com.bwssystems.HABridge.upnp.UpnpListener
12-15-2018 09:24:46.903 | INFO | Traceupnp: send upnp discovery template 3 with response address: 192.168.2.2:80 to address: /192.168.2.42:50000 | com.bwssystems.HABridge.upnp.UpnpListener
12-15-2018 09:24:46.904 | INFO | Traceupnp: SSDP M-SEARCH packet from 192.168.2.42:50000 | com.bwssystems.HABridge.upnp.UpnpListener
12-15-2018 09:24:47.157 | INFO | Traceupnp: send upnp discovery template 1 with response address: 192.168.2.2:80 to address: /192.168.2.42:50000 | com.bwssystems.HABridge.upnp.UpnpListener
12-15-2018 09:24:47.410 | INFO | Traceupnp: send upnp discovery template 2 with response address: 192.168.2.2:80 to address: /192.168.2.42:50000 | com.bwssystems.HABridge.upnp.UpnpListener
12-15-2018 09:24:47.663 | INFO | Traceupnp: send upnp discovery template 3 with response address: 192.168.2.2:80 to address: /192.168.2.42:50000 | com.bwssystems.HABridge.upnp.UpnpListener
12-15-2018 09:24:52.137 | INFO | Link button time ended.... | com.bwssystems.HABridge.LinkButtonPressed
12-15-2018 09:25:14.398 | INFO | Link button time ended.... | com.bwssystems.HABridge.LinkButtonPressed

-------------------------------------------------------------------------------------------------------------------

reading from file output.dat, link-type EN10MB (Ethernet)
09:24:21.703491 ARP, Request who-has 192.168.2.42 tell 192.168.2.2, length 28
............vg.............*
09:24:22.213277 IP 192.168.2.2.1900 > 239.255.255.250.1900: UDP, length 317
E..Y.~@....p.........l.l.E..NOTIFY * HTTP/1.1
HOST: 239.255.255.250:1900
CACHE-CONTROL: max-age=100
LOCATION: http://192.168.2.2:80/description.xml
SERVER: Linux/3.14.0 UPnP/1.0 IpBridge/1.19.0
NTS: ssdp:alive
hue-bridgeid: 02D20BFFFE017667
NT: uuid:2f402f80-da50-11e1-9b23-02d20b017667
USN: uuid:2f402f80-da50-11e1-9b23-02d20b017667


09:24:22.699907 ARP, Request who-has 192.168.2.42 tell 192.168.2.2, length 28
............vg.............*
09:24:23.699901 ARP, Request who-has 192.168.2.42 tell 192.168.2.2, length 28
............vg.............*
09:24:24.752212 ARP, Request who-has 192.168.2.42 tell 192.168.2.2, length 28
............vg.............*
09:24:25.749922 ARP, Request who-has 192.168.2.42 tell 192.168.2.2, length 28
............vg.............*
09:24:26.749925 ARP, Request who-has 192.168.2.42 tell 192.168.2.2, length 28
............vg.............*
09:24:41.504187 IP 192.168.2.2.123 > 212.18.3.19.123: UDP, length 48
E..L.h@.@............{.{.8.........\...d......8..L'V..8.......8..0....8.....
09:24:41.527821 IP 212.18.3.19.123 > 192.168.2.2.123: UDP, length 48
E..L.6@.;............{.{.8iM$......:.......j..6..HS...8.......8....b..8...s.
09:24:42.835332 ARP, Request who-has 192.168.2.2 tell 192.168.2.1, length 46
...........{;x................................
09:24:42.835389 ARP, Reply 192.168.2.2 is-at 02:d2:0b:01:76:67, length 28
............vg.......{;x....
09:24:43.351636 ARP, Request who-has 192.168.2.42 tell 192.168.2.2, length 28
............vg.............*
09:24:43.860393 IP 192.168.2.2.1900 > 239.255.255.250.1900: UDP, length 317
E..Y..@..............l.l.E..NOTIFY * HTTP/1.1
HOST: 239.255.255.250:1900
CACHE-CONTROL: max-age=100
LOCATION: http://192.168.2.2:80/description.xml
SERVER: Linux/3.14.0 UPnP/1.0 IpBridge/1.19.0
NTS: ssdp:alive
hue-bridgeid: 02D20BFFFE017667
NT: uuid:2f402f80-da50-11e1-9b23-02d20b017667
USN: uuid:2f402f80-da50-11e1-9b23-02d20b017667


09:24:44.349913 ARP, Request who-has 192.168.2.42 tell 192.168.2.2, length 28
............vg.............*
09:24:45.349907 ARP, Request who-has 192.168.2.42 tell 192.168.2.2, length 28
............vg.............*
09:24:46.397840 ARP, Request who-has 192.168.2.42 tell 192.168.2.2, length 28
............vg.............*
09:24:47.389907 ARP, Request who-has 192.168.2.42 tell 192.168.2.2, length 28
............vg.............*
09:24:48.389899 ARP, Request who-has 192.168.2.42 tell 192.168.2.2, length 28
............vg.............*
09:25:04.076670 IP 192.168.2.2.1900 > 239.255.255.250.1900: UDP, length 317
E..Y..@..............l.l.E..NOTIFY * HTTP/1.1
HOST: 239.255.255.250:1900
CACHE-CONTROL: max-age=100
LOCATION: http://192.168.2.2:80/description.xml
SERVER: Linux/3.14.0 UPnP/1.0 IpBridge/1.19.0
NTS: ssdp:alive
hue-bridgeid: 02D20BFFFE017667
NT: uuid:2f402f80-da50-11e1-9b23-02d20b017667
USN: uuid:2f402f80-da50-11e1-9b23-02d20b017667


09:25:12.504213 IP 192.168.2.2.123 > 78.47.226.109.123: UDP, length 48
E..L..@.@.Q     ....N/.m.{.{.8.........G..........8..`V...8.......8... {..8.....
09:25:12.532066 IP 78.47.226.109.123 > 192.168.2.2.123: UDP, length 48
E..L>.@.5...N/.m.....{.{.8.'$.....%q..........7.        .F...8.......8...._..8.....
09:25:12.898950 ARP, Request who-has 192.168.2.2 tell 192.168.2.1, length 46
...........{;x................................
09:25:12.899013 ARP, Reply 192.168.2.2 is-at 02:d2:0b:01:76:67, length 28
............vg.......{;x....

**Comment by craigski** [comment]
@Bratensosse I have a hunch. I can see no traffic from your Echo to your Pi. There are many ARP requests that are not being responded to. I think the WiFi that your echo is connected to is in guest mode / device isolation. This means that the echo can see the default gateway, but no other devices on the network. Please check your WiFi configuration that your Echo is connected to.

**Comment by tuicemen** [comment]
I use to have an issue with my Phone grabbing the IP of my HA-Bridge even though my Pi was set to use a static IP. This prevented Alexa from seeing my devices sometimes. Reserving the IP of my PI in my router solved this for me. I actually reserved the IP for all my HA devices which has improved reliability.

**Comment by Bratensosse** [comment]
@craigski thanks for your answer. I checked my wifi settings. My guest mode is disabled. So that can not be the reason. But i do not find something like a "device isolation" or something like that. I checked the wifi configuration as well as the Lan configuration. 

it is very annoying :-(

@tuicemen i my IPs for Pi and echo dot already reserved in my router. it is easier to find them :-)

**Comment by craigski** [comment]
@Bratensosse If you look at your last tcpdump, you will see an ARP request from your router requesting MAC address of Pi, and your Pi responding, this is normal behaviour:

09:24:42.835332 ARP, Request who-has 192.168.2.2 tell 192.168.2.1, length 46
...........{;x................................
09:24:42.835389 ARP, Reply 192.168.2.2 is-at 02:d2:0b:01:76:67, length 28
............vg.......{;x....

Look a little lower and you will see an ARP request from Pi but NO reply to your Echo, this is abnormal:

09:24:44.349913 ARP, Request who-has 192.168.2.42 tell 192.168.2.2, length 28
............vg.............*
09:24:45.349907 ARP, Request who-has 192.168.2.42 tell 192.168.2.2, length 28
............vg.............*
09:24:46.397840 ARP, Request who-has 192.168.2.42 tell 192.168.2.2, length 28
............vg.............*
09:24:47.389907 ARP, Request who-has 192.168.2.42 tell 192.168.2.2, length 28
............vg.............*
09:24:48.389899 ARP, Request who-has 192.168.2.42 tell 192.168.2.2, length 28
............vg.............*

Something on your network is not configured correctly, your LAN is unable to see the Echo on WiFi. Once the habridge/pi is able to communicate with the Echo, there will be more chance that habridge will function :)

**Comment by craigski** [comment]
Looking at your devices in first tcpdump you have something called fritz.repeater, I assume this is your wireless extender? Is you echo connected to that? Is Guest mode turned on on that fritzrepeater?

I did a google 'fritz repeater guest mode'
page 31 ?
https://gzhls.at/blob/ldb/b/6/f/2/21e18129a05bb198cb28c9bddb1da59b93e2.pdf



21:28:35.880924 ARP, Request who-has amazon-xxxxxxxxxx.local tell **fritz.repeater.local,** length 46
21:28:36.915623 ARP, Request who-has amazon-xxxxxxxxxx.local tell octopi.local, length 46
21:28:36.944498 ARP, Request who-has amazon-xxxxxxxxxx.local tell bananapi, length 28
21:28:37.002115 ARP, Request who-has amazon-xxxxxxxxxx.local tell Notebook.local, length 46
21:28:51.316898 ARP, Request who-has amazon-xxxxxxxxxx.local tell easy.box.local, length 46

**Comment by Bratensosse** [comment]
@craigski you are very attentively :-)

yes it is an wireless extender to use Wifi in my cellar where my workshop is. There are Wifi connected 3D-Printer with a cam streaming the video while printing. This video stream can be seen on wifi and Lan connected devices. But maybe you are right.  For testing your guess i can switch off the repeater and i will try it again. So Thanks for that idea.

**Comment by Bratensosse** [comment]
Ok, i switched off the wifi repeater and any other wifi device which is not in use (TV, iPad..) and tried it again with the same result. Then i tried to open habridge on my test pi (pi zero w). So the conection is not over LAN (habridge)<->router <->wifi (echo dot) rather wif(pi zero w with habridge)i<->router<->wifi(echo dot). Well, the result is the same.

I borrow a amazon smart plug to test the wifi<->wifi conection. If the used protokoll is similar to habridge, maybe i can locate the problem.

**Comment by ArthurGerla** [comment]
FWIW, I ran into a similar situation yesterday, where Alexa on my Echo dot 2 wouldn't detect any new devices and reported my existing devices offline (which wasn't the case as HA-Bridge was running and functioning just fine). On a hunch, after reading this thread I rebooted the router and that did the trick :-P
